#,BJCP Categories,Styles,Style Family,Style_Family_ID,StyleID,Style History,Origin,ABV min,ABV max,IBUs min,IBUs max,SRM min,SRM max,OG min,OG max,FG min,FG max,Overall Impression,Aroma,Appearance,Flavor,Mouthfell,Comments,History,Characteristic Ingredients,Style Comparison,Commercial Examples,Notes,,,
11A,British Bitter,Ordinary Bitter,Amber Ale,4,118,English Pale Ale,England,3.2,3.8,25,35,8,14,1030,1039,1007,1011,"Low gravity, low alcohol levels, and low carbonation make this an easy-drinking session beer. The malt profile can vary in flavor and intensity, but should never override the overall bitter impression. Drinkability is a critical component of the style ","Low to moderate malt aroma, often (but not always) with a light caramel quality. Bready, biscuity, or lightly toasty malt complexity is common. Mild to moderate fruitiness. Hop aroma can range from moderate to none, typically with a floral, earthy, resiny, and/or fruity character. Generally no diacetyl, although very low levels are allowed. ",Pale amber to light copper color. Good to brilliant clarity. Low to moderate white to off-white head. May have very little head due to low carbonation.,"Medium to moderately high bitterness. Moderately low to moderately high fruity esters. Moderate to low hop flavor, typically with an earthy, resiny, fruity, and/or floral character. Low to medium maltiness with a dry finish. The malt profile is typically bready, biscuity, or lightly toasty. Low to moderate caramel or toffee flavors are optional. Balance is often decidedly bitter, although the bitterness should not completely overpower the malt flavor, esters and hop flavor. Generally no diacetyl, although very low levels are allowed.","Light to medium-light body. Low carbonation, although bottled examples can have moderate carbonation.","The lowest gravity member of the British Bitter family, typically known to consumers simply as “bitter” (although brewers tend to refer to it as Ordinary Bitter to distinguish it from other members of the family). ",See comments in category introduction.,"Pale ale, amber, and/or crystal malts. May use a touch of dark malt for color adjustment. May use sugar adjuncts, corn, or wheat. English finishing hops are most traditional, but any hops are fair game; if American hops are used, a light touch is required. Characterful British yeast. ","Some modern variants are brewed exclusively with pale malt and are known as golden ales, summer ales, or golden bitters. Emphasis is on the bittering hop addition as opposed to the aggressive middle and late hopping seen in American ales.","Adnams Southwold Bitter, Brains Bitter, Fuller's Chiswick Bitter, Greene King IPA, Tetley’s Original Bitter, Young's Bitter",,,,
11B,British Bitter,Best Bitter,Amber Ale,4,28,English Pale Ale,England,3.8,4.6,25,40,8,16,1040,1048,1008,1012,"A flavorful, yet refreshing, session beer. Some examples can be more malt balanced, but this should not override the overall bitter impression. Drinkability is a critical component of the style.","Low to moderate malt aroma, often (but not always) with a low to medium-low caramel quality. Bready, biscuit, or lightly toasty malt complexity is common. Mild to moderate fruitiness. Hop aroma can range from moderate to none, typically with a floral, earthy, resiny, and/or fruity character. Generally no diacetyl, although very low levels are allowed.",Pale amber to medium copper color. Good to brilliant clarity. Low to moderate white to off-white head. May have very little head due to low carbonation.,"Medium to moderately high bitterness. Moderately low to moderately high fruity esters. Moderate to low hop flavor, typically with an earthy, resiny, fruity, and/or floral character. Low to medium maltiness with a dry finish. The malt profile is typically bready, biscuity, or lightly toasty. Low to moderate caramel or toffee flavors are optional. Balance is often decidedly bitter, although the bitterness should not completely overpower the malt flavor, esters and hop flavor. Generally no diacetyl, although very low levels are allowed.","Medium-light to medium body. Low carbonation, although bottled examples can have moderate carbonation.","More evident malt flavor than in an ordinary bitter, this is a stronger, session-strength ale. ",See comments in category introduction.,"Pale ale, amber, and/or crystal malts. May use a touch of dark malt for color adjustment. May use sugar adjuncts, corn or wheat. English finishing hops are most traditional, but any hops are fair game; if American hops are used, a light touch is required. Characterful British yeast.","More alcohol than an ordinary bitter, and often using higher-quality ingredients. Less alcohol than a strong bitter. More caramel or base malt character and color than a British Golden Ale. Emphasis is on the bittering hop addition as opposed to the aggressive middle and late hopping seen in American ales.","Adnams SSB, Coniston Bluebird Bitter, Fuller's London Pride, Harvey’s Sussex Best Bitter, Shepherd Neame Master Brew Kentish Ale, Timothy Taylor Landlord,  Young’s Special",,,,
11C,British Bitter,Strong Bitter,Amber Ale,4,159,English Pale Ale,England,4.6,6.2,30,50,8,18,1048,1060,1010,1016,An average-strength to moderately-strong British bitter ale. The balance may be fairly even between malt and hops to somewhat bitter. Drinkability is a critical component of the style. A rather broad style that allows for considerable interpretation by the brewer.,"Hop aroma moderately-high to moderately-low, typically with a floral, earthy, resiny, and/or fruity character. Medium to medium-high malt aroma, optionally with a low to moderate caramel component. Medium-low to medium-high fruity esters. Generally no diacetyl, although very low levels are allowed. ",Light amber to deep copper color. Good to brilliant clarity. Low to moderate white to off-white head. A low head is acceptable when carbonation is also low.,"Medium to medium-high bitterness with supporting malt flavors evident. The malt profile is typically bready, biscuity, nutty, or lightly toasty, and optionally has a moderately low to moderate caramel or toffee flavor. Hop flavor moderate to moderately high, typically with a floral, earthy, resiny, and/or fruity character. Hop bitterness and flavor should be noticeable, but should not totally dominate malt flavors. Moderately-low to high fruity esters. Optionally may have low amounts of alcohol. Medium-dry to dry finish. Generally no diacetyl, although very low levels are allowed.","Medium-light to medium-full body. Low to moderate carbonation, although bottled versions will be higher. Stronger versions may have a slight alcohol warmth but this character should not be too high.","In England today, “ESB” is a Fullers trademark, and no one thinks of it as a generic class of beer. It is a unique (but very well-known) beer that has a very strong, complex malt profile not found in other examples, often leading judges to overly penalize traditional English strong bitters. In America, ESB has been co-opted to describe a malty, bitter, reddish, standard-strength (for the US) British-type ale, and is a popular craft beer style. This may cause some judges to think of US brewpub ESBs as representative of this style. ","See comments in category introduction. Strong bitters can be seen as a higher-gravity version of best bitters (although not necessarily “more premium” since best bitters are traditionally the brewer’s finest product). British pale ales are generally considered a premium, export-strength pale, bitter beer that roughly approximates a strong bitter, although reformulated for bottling (including increasing carbonation levels). While modern British pale ale is considered a bottled bitter, historically the styles were different.","Pale ale, amber, and/or crystal malts, may use a touch of black malt for color adjustment. May use sugar adjuncts, corn or wheat. English finishing hops are most traditional, but any hops are fair game; if American hops are used, a light touch is required. Characterful British yeast. Burton versions use medium to high sulfate water, which can increase the perception of dryness and add a minerally or sulfury aroma and flavor.","More evident malt and hop flavors than in a special or best bitter, as well as more alcohol. Stronger versions may overlap somewhat with British strong ales, although strong bitters will tend to be paler and more bitter. More malt flavor (particularly caramel) and esters than an American Pale Ale, with different finishing hop character.","Bass Ale, Highland Orkney Blast, Samuel Smith’s Old Brewery Pale Ale, Shepherd Neame Bishop's Finger, Shepherd Neame Spitfire, West Berkshire Dr. Hexter’s Healer, Whitbread Pale Ale, Young’s Ram Rod",,,,
12A,Pale Commonwealth Beer,British Golden Ale,Pale Ale,2,35,Pale Ales,England,3.8,5,20,45,2,6,1038,1053,1006,1012,"A hop-forward, average-strength to moderately-strong pale bitter. Drinkability and a refreshing quality are critical components of the style. ","Hop aroma is moderately low to moderately high, and can use any variety of hops – floral, herbal, or earthy English hops and citrusy American hops are most common. Frequently a single hop varietal will be showcased. Little to no malt aroma; no caramel. Medium-low to low fruity aroma from the hops rather than esters. Little to no diacetyl.",Straw to golden in color. Good to brilliant clarity. Low to moderate white head. A low head is acceptable when carbonation is also low.,"Medium to medium-high bitterness. Hop flavor is moderate to moderately high of any hop variety, although citrus flavors are increasingly common. Medium-low to low malt character, generally bready with perhaps a little biscuity flavor. Caramel flavors are typically absent. Little to no diacetyl. Hop bitterness and flavor should be pronounced. Moderately-low to low esters. Medium-dry to dry finish. Bitterness increases with alcohol level, but is always balanced.","Light to medium body. Low to moderate carbonation on draught, although bottled commercial versions will be higher. Stronger versions may have a slight alcohol warmth, but this character should not be too high.","Well-hopped, quenching beer with an emphasis on showcasing hops. Served colder than traditional bitters, this style was originally positioned as a refreshing summer beer, but is now often brewed year-round. Although early on the beers were brewed with English hops, increasingly American citrus-flavored hops are used. Golden Ales are also called Golden Bitters, Summer Ales, or British Blonde Ales. Can be found in cask, keg, and bottle.","Modern golden ales were developed in England to take on strongly-marketed lagers. While it is difficult to identify the first, Hop Back's Summer Lightning, first brewed in 1986, is thought by many to have got the style off the ground.","Low-color pale or lager malt acting as a blank canvas for the hop character. May use sugar adjuncts, corn or wheat. English hops frequently used, although citrusy American varietals are becoming more common. Somewhat clean-fermenting British yeast.","More similar to an American Pale Ale than anything else, although it is often lower in alcohol and usually features British ingredients. Has no caramel and fewer esters compared to British bitters and pale ales. Dry as bitters but with less malt character to support the hops, giving a different balance. Often uses (and features) American hops, more so than most other modern British styles.","Crouch Vale Brewers Gold, Fuller's Discovery, Golden Hill Exmoor Gold, Hop Back Summer Lightning, Kelham Island Pale Rider, Morland Old Golden Hen, Oakham JHB",,,,
12B,Pale Commonwealth Beer,Australian Sparkling Ale,Pale Ale,2,17,Pale Ales,Australian,4.5,6,20,35,4,7,1038,1050,1004,1006,"Smooth and balanced, all components merge together with similar intensities. Moderate flavors showcasing Australian ingredients. Large flavor dimension. Very drinkable, suited to a hot climate. Relies on yeast character.","Fairly soft, clean aroma with a balanced mix of esters, hops, malt, and yeast – all moderate to low in intensity. The esters are frequently pears and apples, possibly with a very light touch of banana (optional). The hops are earthy, herbaceous, or might show the characteristic iron-like Pride of Ringwood nose. The malt can range from neutral grainy to moderately sweet to lightly bready; no caramel should be evident. Very fresh examples can have a lightly yeasty, sulfury nose.","Deep yellow to light amber in color, often medium gold. Tall, frothy, persistent white head with tiny bubbles. Noticeable effervescence due to high carbonation. Brilliant clarity if decanted, but typically poured with yeast to have a cloudy appearance. Not typically cloudy unless yeast roused during the pour.","Medium to low rounded, grainy to bready malt flavor, initially mild to malty-sweet but a medium to medium-high bitterness rises mid-palate to balance the malt. Caramel flavors typically absent. Highly attenuated, giving a dry finish with lingering bitterness, although the body gives an impression of fullness. Medium to medium-high hop flavor, somewhat earthy and possibly herbal, resinous, peppery, or iron-like but not floral, lasting into aftertaste. Medium-high to medium-low esters, often pears and apples. Banana is optional, but should never dominate. May be lightly minerally or sulfury, especially if yeast is present. Should not be bland.","High to very high carbonation, giving mouth-filling bubbles and a crisp, spritzy carbonic bite. Medium to medium-full body, tending to the higher side if poured with yeast. Smooth but gassy. Stronger versions may have a light alcohol warmth, but lower alcohol versions will not. Very well-attenuated; should not have any residual sweetness.","Coopers has been making their flagship Sparkling Ale since 1862, although the formulation has changed over the years. Presently the beer will have brilliant clarity if decanted, but publicans often pour most of the beer into a glass then swirl the bottle and dump in all the yeast. In some bars, the bottle is rolled along the bar! When served on draught, the brewery instructs publicans to invert the keg to rouse the yeast. A cloudy appearance for the style seems to be a modern consumer preference. Always naturally carbonated, even in the keg. A present-use ale, best enjoyed fresh.","Brewing records show that the majority of Australian beer brewed in the 19th century was draught XXX (Mild) and porter. Ale in bottle was originally developed to compete with imported bottled pale ales from British breweries, such as Bass and Wm Younger’ Monk. By the early 20th century, bottled pale ale went out of fashion and “lighter” lager beers were in vogue. Many Australian Sparkling and Pale Ales were labeled as ales, but were actually bottom-fermented lagers with very similar grists to the ales that they replaced. Coopers of Adelaide, South Australia is the only surviving brewer producing the Sparkling Ale style.","Lightly kilned Australian 2-row pale malt, lager varieties may be used. Small amounts of crystal malt for color adjustment only. Modern examples use no adjuncts, cane sugar for priming only. Historical examples using 45% 2 row, 30% higher protein malt (6 row) would use around 25% sugar to dilute the nitrogen content. Traditionally used Australian hops, Cluster, and Goldings until replaced from mid-1960s by Pride of Ringwood. Highly attenuative Burton-type yeast (Australian-type strain typical). Variable water profile, typically with low carbonate and moderate sulfate.","Superficially similar to English Pale Ales, although much more highly carbonated, with less caramel, less late hops, and showcasing the signature yeast strain and hop variety. More bitter than IBUs might suggest due to high attenuation, low final gravity, and somewhat coarse hops. ","Coopers Original Pale Ale, Coopers Sparkling Ale",,,,
12C,Pale Commonwealth Beer,English IPA,IPA,6,65,English Pale Ale,England,5,7.5,40,60,6,14,1050,1075,1010,1018,"A hoppy, moderately-strong, very well-attenuated pale British ale with a dry finish and a hoppy aroma and flavor. Classic British ingredients provide the best flavor profile. ","A moderate to moderately-high hop aroma of floral, spicy-peppery or citrus-orange in nature is typical. A slightly grassy dry-hop aroma is acceptable, but not required. A moderately-low caramel-like or toasty malt presence is optional. Low to moderate fruitiness is acceptable. Some versions may have a sulfury note, although this character is not mandatory.","Color ranges from golden to deep amber, but most are fairly pale. Should be clear, although unfiltered dry-hopped versions may be a bit hazy. Moderate-sized, persistent head stand with off-white color.","Hop flavor is medium to high, with a moderate to assertive hop bitterness. The hop flavor should be similar to the aroma (floral, spicy-peppery, citrus-orange, and/or slightly grassy). Malt flavor should be medium-low to medium, and be somewhat bready, optionally with light to medium-light biscuit-like, toasty, toffee-like and/or caramelly aspects. Medium-low to medium fruitiness. Finish is medium-dry to very dry, and the bitterness may linger into the aftertaste but should not be harsh. The balance is toward the hops, but the malt should still be noticeable in support. If high sulfate water is used, a distinctively minerally, dry finish, some sulfur flavor, and a lingering bitterness are usually present. Some clean alcohol flavor can be noted in stronger versions. Oak is inappropriate in this style.","Smooth, medium-light to medium-bodied mouthfeel without hop-derived astringency, although moderate to medium-high carbonation can combine to render an overall dry sensation despite a supportive malt presence. A low, smooth alcohol warming can and should be sensed in stronger (but not all) versions.","The attributes of IPA that were important to its arrival in good condition in India were that it was very well-attenuated, and heavily hopped. Simply because this is how IPA was shipped, doesn’t mean that other beers such as Porter weren’t also sent to India, that IPA was invented to be sent to India, that IPA was more heavily hopped than other keeping beers, or that the alcohol level was unusual for the time. Many modern examples labeled IPA are quite weak in strength. According to CAMRA, “so-called IPAs with strengths of around 3.5% are not true to style.” English beer historian Martyn Cornell has commented that beers like this are “not really distinguishable from an ordinary bitter.” So we choose to agree with these sources for our guidelines rather than what some modern British breweries are calling an IPA; just be aware of these two main types of IPAs in the British market today.","Accounts of its origins vary, but most agree that what became later known as IPA was pale ale prepared for shipment to India in the late 1700s and early 1800s. George Hodgson of the Bow Brewery became well-known as an exporter of IPA during the early 1800s, and is the first name frequently mentioned with its popularity. As with all English beers with a long history, the popularity and formulation of the product changed over time. Burton breweries with their high-sulfate water were able to successfully brew IPA and began their domination of this market by the 1830s, around the time the name India Pale Ale was first used. Strength and popularity declined over time, and the style virtually disappeared in the second half of the 20th century. The name was often used to describe pale ales and bitters, not anything special (a trend that continues in some modern British examples). The style underwent a craft beer rediscovery in the 1980s, and is what is described in these guidelines. Modern examples are inspired by classic versions, but shouldn’t be assumed to have an unbroken lineage with the exact same profile. White Shield is probably the example with the longest lineage, tracing to the strong Burton IPAs of old and first brewed in 1829.","Pale ale malt. English hops are traditional, particularly as finishing hops. Attenuative British ale yeast. Refined sugar may be used in some versions. Some versions may show a sulfate character from Burton-type water, but this is not essential to the style.",Generally will have more finish hops and less fruitiness and/or caramel than British pale ales and bitters. Has less hop intensity and a more pronounced malt flavor than typical American versions.,"Freeminer Trafalgar IPA, Fuller's Bengal Lancer IPA, Meantime India Pale Ale, Ridgeway IPA, Summit True Brit IPA, Thornbridge Jaipur, Worthington White Shield",,,,
13A,Brown British Beer,Dark Mild,Brown Ale,7,53,English Mild,England,3,3.8,10,25,12,25,1030,1038,1008,1013,"A dark, low-gravity, malt-focused British session ale readily suited to drinking in quantity. Refreshing, yet flavorful, with a wide range of dark malt or dark sugar expression.","Low to moderate malt aroma, and may have some fruitiness. The malt expression can take on a wide range of character, which can include caramel, toffee, grainy, toasted, nutty, chocolate, or lightly roasted. Little to no hop aroma, earthy or floral if present. Very low to no diacetyl.","Copper to dark brown or mahogany color. A few paler examples (medium amber to light brown) exist. Generally clear, although is traditionally unfiltered. Low to moderate off-white to tan head; retention may be poor.","Generally a malty beer, although may have a very wide range of malt- and yeast-based flavors (e.g., malty, sweet, caramel, toffee, toast, nutty, chocolate, coffee, roast, fruit, licorice, plum, raisin). Can finish sweet to dry. Versions with darker malts may have a dry, roasted finish. Low to moderate bitterness, enough to provide some balance but not enough to overpower the malt. Fruity esters moderate to none. Diacetyl and hop flavor low to none.",Light to medium body. Generally low to medium-low carbonation. Roast-based versions may have a light astringency. Sweeter versions may seem to have a rather full mouthfeel for the gravity.,"Most are low-gravity session beers around 3.2%, although some versions may be made in the stronger (4%+) range for export, festivals, seasonal and/or special occasions. Generally served on cask; session-strength bottled versions don’t often travel well. A wide range of interpretations are possible. Pale versions exist, but these are even more rare than dark milds; these guidelines only describe the modern dark version.","Historically, ‘mild’ was simply an unaged beer, and could be used as an adjective to distinguish between aged or more highly hopped keeping beers. Modern milds trace their roots to the weaker X-type ales of the 1800s, although dark milds did not appear until the 20th century. In current usage, the term implies a lower-strength beer with less hop bitterness than bitters. The guidelines describe the modern British version. The term ‘mild’ is currently somewhat out of favor with consumers, and many breweries no longer use it. Increasingly rare. There is no historic connection or relationship between Mild and Porter.",Style Comparison: Some versions may seem like lower-gravity modern English porters. Much less sweet than London Brown Ale.,"Characteristic Ingredients: Pale British base malts (often fairly dextrinous), crystal malt, dark malts or dark sugar adjuncts, may also include adjuncts such as flaked maize, and may be colored with brewer’s caramel. Characterful British ale yeast. Any type of hops, since their character is muted and rarely is noticeable.","Banks's Mild, Cain's Dark Mild, Highgate Dark Mild, Brain’s Dark, Moorhouse Black Cat, Rudgate Ruby Mild, Theakston Traditional Mild",,,,
