#,BJCP Categories,Styles,Style Family,Style_Family_ID,StyleID,Style History,Origin,ABV min,ABV max,IBUs min,IBUs max,SRM min,SRM max,OG min,OG max,FG min,FG max,Overall Impression,Aroma,Appearance,Flavor,Mouthfell,Comments,History,Characteristic Ingredients,Style Comparison,Commercial Examples,Notes,,,
23A,European Sour Ale,Berliner Weisse,Wheat Beer,3,27,German Sour Ale,Germany,2.8,3.8,3,8,2,3,1028,1032,1003,1006,"A very pale, refreshing, low-alcohol German wheat beer with a clean lactic sourness and a very high carbonation level. A light bread dough malt flavor supports the sourness, which shouldn’t seem artificial. Any Brettanomyces funk is restrained.","A sharply sour character is dominant (moderate to moderately-high). Can have up to a moderately fruity character (often lemony or tart apple). The fruitiness may increase with age and a light flowery character may develop. No hop aroma. The wheat may present as uncooked bread dough in fresher versions; combined with the acidity, may suggest sourdough bread. May optionally have a restrained funky Brettanomyces character.","Very pale straw in color. Clarity ranges from clear to somewhat hazy. Large, dense, white head with poor retention. Always effervescent.","Clean lactic sourness dominates and can be quite strong. Some complementary doughy, bready or grainy wheat flavor is generally noticeable. Hop bitterness is undetectable; sourness provides the balance rather than hops. Never vinegary. A restrained citrusy-lemony or tart apple fruitiness may be detected. Very dry finish. Balance dominated by sourness, but some malt flavor should be present. No hop flavor. May optionally have a restrained funky Brettanomyces character. ","Light body. Very high carbonation. No sensation of alcohol. Crisp, juicy acidity.","In Germany, it is classified as a Schankbier denoting a small beer of starting gravity in the range 7-8 °P. Often served with the addition of a shot of sugar syrups (mit schuss) flavored with raspberry (himbeer), woodruff (waldmeister), or Caraway schnapps (Kümmel) to counter the substantial sourness. Has been described by some as the most purely refreshing beer in the world.","A regional specialty of Berlin; referred to by Napoleon's troops in 1809 as “the Champagne of the North” due to its lively and elegant character. At one point, it was smoked and there used to be Märzen-strength (14 °P) version. Increasingly rare in German, but some American craft breweries now regularly produce the style.","Wheat malt content is typically 50% of the grist (as is tradition with all German wheat beers) with the remainder typically being Pilsner malt. A symbiotic fermentation with top-fermenting yeast and Lactobacillus (various strains) provides the sharp sourness, which may be enhanced by blending of beers of different ages during fermentation and by extended cool aging. Hop bitterness is non-existent. Decoction mashing with mash hopping is traditional. German brewing scientists believe that Brettanomyces is essential to get the correct flavor profile, but this character is never strong.","Compared to a lambic, is generally not as acidic and has a clean lactic sourness with restrained to below sensory threshold funk. Also lower in alcohol content.","Bayerischer Bahnhof Berliner Style Weisse, Berliner Kindl Weisse, Nodding Head Berliner Weisse, The Bruery Hottenroth",,,,
23D,European Sour Ale,Lambic,Wheat Beer,3,98,Belgian Sour Ale,Belgium,5,6.5,0,10,3,7,1040,1054,1001,1010,"A fairly sour, often moderately funky wild Belgian wheat beer with sourness taking the place of hop bitterness in the balance. Traditionally spontaneously fermented in the Brussels area and served uncarbonated, the refreshing acidity makes for a very pleasant café drink. ","A decidedly sour aroma is often dominant in young examples, but may become more subdued with age as it blends with aromas described as barnyard, earthy, goaty, hay, horsey, and horse blanket. A mild citrus-fruity aroma is considered favorable. An enteric, smoky, cigar-like, or cheesy aroma is unfavorable. Older versions are commonly fruity with aromas of apples or even honey. No hop aroma. ","Pale yellow to deep golden in color; age tends to darken the beer. Clarity is hazy to good. Younger versions are often cloudy, while older ones are generally clear. White colored head generally has poor retention.","Young examples are often noticeably lactic-sour, but aging can bring this character more in balance with the malt, wheat and barnyard characteristics. Fruity flavors are simpler in young lambics and more complex in the older examples, where they are reminiscent of apples or other light fruits, rhubarb, or honey. Some citrus flavor (often grapefruit) is occasionally noticeable, and is desirable. The malt and wheat character are typically low with some bready-grainy notes. An enteric, smoky or cigar-like character is undesirable. Hop bitterness is low to none, and generally undetectable; sourness provides the balance. Typically has a dry finish. No hop flavor.","Light to medium-light body. In spite of the low finishing gravity, the many mouth-filling flavors prevent the beer from feeling like water. As a rule of thumb, lambic dries with age, which makes dryness a reasonable indicator of age. Has a medium to high tart, puckering quality without being sharply astringent. Traditional versions are virtually to completely uncarbonated, but bottled examples can pick up moderate carbonation with age.","Straight lambics are single-batch, unblended beers. Since they are unblended, the straight lambic is often a true product of the “house character” of a brewery and will be more variable than a gueuze. They are generally served young (6 months) and on tap as cheap, easy-drinking beers without any filling carbonation. Younger versions tend to be one-dimensionally sour since a complex Brett character often takes upwards of a year to develop. An enteric character is often indicative of a lambic that is too young. A noticeable vinegary or cidery character is considered a fault by Belgian brewers. Since the wild yeast and bacteria will ferment ALL sugars, they are typically bottled only when they have completely fermented. ",Spontaneously fermented wild ales from the area in and around Brussels (the Senne Valley) stem from a farmhouse brewing tradition several centuries old. The number of producers is constantly dwindling.,"Unmalted wheat (30-40%), Pilsner malt and aged hops (3 years) are used. The aged hops are used more for preservative effects than bitterness, and makes actual bitterness levels difficult to estimate. Traditionally these beers are spontaneously fermented with naturally occurring yeast and bacteria in predominately oaken barrels. The barrels used are neutral with little oak character, so don’t expect a fresh or forward oak character – more neutral is typical. Home-brewed and craft-brewed versions are more typically made with pure cultures of yeast commonly including Saccharomyces, Brettanomyces, Pediococcus and Lactobacillus in an attempt to recreate the effects of the dominant microbiota of Brussels and the surrounding countryside of the Senne River valley. Cultures taken from bottles are sometimes used but there is no simple way of knowing what organisms are still viable.","Generally has a more simple sourness and complexity than a gueuze. Traditionally served uncarbonated from pitchers, while gueuze is bottled and very highly carbonated. ","The only bottled version readily available is Cantillon Grand Cru Bruocsella of whatever single batch vintage the brewer deems worthy to bottle. De Cam sometimes bottles their very old (5 years) lambic. In and around Brussels there are specialty cafes that often have draught lambics from traditional brewers or blenders such as Boon, De Cam, Cantillon, Drie Fonteinen, Lindemans, Timmermans and Girardin.",,,,
23F,European Sour Ale,Fruit Lambic,Wheat Beer,3,77,Belgian Sour Ale,Belgium,5,7,0,10,3,7,1040,1060,1000,1010,"A complex, fruity, pleasantly sour, wild wheat ale fermented by a variety of Belgian microbiota, and showcasing the fruit contributions blended with the wild character. The type of fruit can sometimes be hard to identify as fermented and aged fruit characteristics can seem different from the more recognizable fresh fruit aromas and flavors.","The specified fruit should be the dominant aroma. A low to moderately sour character blends with aromas described as barnyard, earthy, goaty, hay, horsey, and horse blanket (and thus should be recognizable as a lambic). The fruit aroma commonly blends well with the other aromas. An enteric, smoky, cigar-like, or cheesy aroma is unfavorable. No hop aroma.","The variety of fruit generally determines the color, although lighter-colored fruit may have little effect on the color. The color intensity may fade with age. Clarity is often good, although some fruit will not drop bright. A thick rocky, mousse-like head, sometimes a shade of fruit, is generally long-lasting (carbonation-dependent). Carbonation is typically high, but must be specified.","The specified fruit should be evident. Low to moderately sour flavor, often with an acidic bite in the finish. The classic barnyard characteristics may be low to high. When young, the beer will present its full fruity taste. As it ages, the lambic taste will become dominant at the expense of the fruit character—thus fruit lambics are not intended for long aging. The finish is commonly dry and tart, but a low, complementary sweetness may be present; higher sweetness levels are not traditional but can be included for personal preference (sweetness level must be specified). A mild vanilla and/or oak flavor is occasionally noticeable. An enteric, smoky or cigar-like character is undesirable. Hop bitterness is generally absent; acidity provides the balance. No hop flavor. ","Light to medium-light body. In spite of the low finishing gravity, the many mouth-filling flavors prevent the beer from tasting like water. Has a low to high tart, puckering quality without being sharply astringent. Some versions have a light warming character. Carbonation can vary from sparkling to nearly still (must be specified).","Fruit-based lambics are often produced like gueuze by mixing one, two, and three-year old lambic. “Young” lambic contains fermentable sugars while old lambic has the characteristic “wild” taste of the Senne River valley. Fruit is commonly added halfway through aging and the yeast and bacteria will ferment all sugars from the fruit. Fruit may also be added to unblended lambic. The most traditional styles of fruit lambics include kriek (cherries), framboise (raspberries) and druivenlambik (muscat grapes). IBUs are approximate since aged hops are used; Belgians use hops for anti-bacterial properties more than bittering in lambics.","Spontaneously fermented wild ales from the area in and around Brussels (the Senne Valley) stem from a farmhouse brewing and blending tradition several centuries old. The number of producers is constantly dwindling and some are untraditionally sweetening their products (post-fermentation) with sugar or sweet fruit to make them more palatable to a wider audience. Fruit was traditionally added to lambic or gueuze, either by the blender or publican, to increase the variety of beers available in local cafes.","Unmalted wheat (30-40%), Pilsner malt and aged hops (3 years) are used. The aged hops are used more for preservative effects than bitterness, and makes actual bitterness levels difficult to estimate. Traditional products use 10-30% fruit (25%, if cherry). Fruits traditionally used include tart cherries (with pits), raspberries or Muscat grapes. More recent examples include peaches, apricots or merlot grapes. Tart or acidic fruit is traditionally used as its purpose is not to sweeten the beer but to add a new dimension. Traditionally these beers are spontaneously fermented with naturally occurring yeast and bacteria in predominately oaken barrels. The barrels used are old and have little oak character, so don’t expect a fresh or forward oak character – more neutral is typical. Home-brewed and craft-brewed versions are more typically made with pure cultures of yeast commonly including Saccharomyces, Brettanomyces, Pediococcus and Lactobacillus in an attempt to recreate the effects of the dominant microbiota of Brussels and the surrounding countryside of the Senne River valley. Cultures taken from bottles are sometimes used but there is no simple way of knowing what organisms are still viable.","A lambic with fruit, not just a fruit beer; the wild lambic character must be evident.","Boon Framboise Marriage Parfait, Boon Kriek Mariage Parfait, Boon Oude Kriek, Cantillon Fou’ Foune, Cantillon Kriek, Cantillon Lou Pepe Kriek, Cantillon Lou Pepe Framboise, Cantillon Rose de Gambrinus, Cantillon St. Lamvinus, Cantillon Vigneronne, De Cam Oude Kriek, Drie Fonteinen Kriek, Girardin Kriek, Hanssens Oude Kriek, Oud Beersel Kriek, Mort Subite Kriek",,,,
24A,Belgian Ale,Witbier,Wheat Beer,3,175,Wheat Beer,Belgium,4.5,5.5,8,20,2,4,1044,1052,1008,1012,"A refreshing, elegant, tasty, moderate-strength wheat-based ale.","Moderate malty sweetness (often with light notes of honey and/or vanilla) with light, grainy, spicy wheat aromatics, often with a bit of tartness. Moderate perfumy coriander, often with a complex herbal, spicy, or peppery note in the background. Moderate zesty, citrusy-orangey fruitiness. A low spicy-herbal hop aroma is optional, but should never overpower the other characteristics. Vegetal, celery-like, or ham-like aromas are inappropriate. Spices should blend in with fruity, floral and sweet aromas and should not be overly strong.","Very pale straw to very light gold in color. The beer will be very cloudy from starch haze and/or yeast, which gives it a milky, whitish-yellow appearance. Dense, white, moussy head. Head retention should be quite good.","Pleasant malty-sweet grain flavor (often with a honey and/or vanilla character) and a zesty, orange-citrusy fruitiness. Refreshingly crisp with a dry, often tart, finish. Can have a low bready wheat flavor. Optionally has a very light lactic-tasting sourness. Herbal-spicy flavors, which may include coriander and other spices, are common should be subtle and balanced, not overpowering. A spicy-earthy hop flavor is low to none, and if noticeable, never gets in the way of the spices. Hop bitterness is low to medium-low, and doesn’t interfere with refreshing flavors of fruit and spice, nor does it persist into the finish. Bitterness from orange pith should not be present. Vegetal, celery-like, ham-like, or soapy flavors are inappropriate. ","Medium-light to medium body, often having a smoothness and light creaminess from unmalted wheat and the occasional oats. Despite body and creaminess, finishes dry and often a bit tart. Effervescent character from high carbonation. Refreshing, from carbonation, light acidity, and lack of bitterness in finish. No harshness or astringency from orange pith. Should not be overly dry and thin, nor should it be thick and heavy.","The presence, character and degree of spicing and lactic sourness varies. Overly spiced and/or sour beers are not good examples of the style. Coriander of certain origins might give an inappropriate ham or celery character. The beer tends to be fragile and does not age well, so younger, fresher, properly handled examples are most desirable. Most examples seem to be approximately 5% ABV.","A 400-year-old Belgian beer style that died out in the 1950s; it was later revived by Pierre Celis at Hoegaarden, and has grown steadily in popularity over time, both with modern craft brewers and mass-market producers who see it as a somewhat fruity summer seasonal beer. ","About 50% unmalted wheat and 50% pale barley malt (usually Pils malt) constitute the grist. In some versions, up to 5-10% raw oats may be used. Spices of freshly-ground coriander and Curaçao or sometimes sweet orange peel complement the sweet aroma and are quite characteristic. Other spices (e.g., chamomile, cumin, cinnamon, Grains of Paradise) may be used for complexity but are much less prominent. Ale yeast prone to the production of mild, spicy flavors is very characteristic. In some instances a very limited lactic fermentation, or the actual addition of lactic acid, is done.","Low bitterness level with a balance similar to a Weissbier, but with spice and citrus character coming from additions rather than the yeast.","Allagash White, Blanche de Bruxelles, Celis White, Hoegaarden Wit, Ommegang Witte, St. Bernardus Witbier, Wittekerke",,,,
24B,Belgian Ale,Belgian Pale Ale,Pale Ale,2,24,Pale Ales,Belgium,4.8,5.5,20,30,8,14,1048,1054,1010,1014,"A moderately malty, somewhat fruity, easy-drinking, copper-colored Belgian ale that is somewhat less aggressive in flavor profile than many other Belgian beers. The malt character tends to be a bit biscuity with light toasty, honey-like, or caramelly components; the fruit character is noticeable and complementary to the malt. The bitterness level is generally moderate, but may not seem as high due to the flavorful malt profile.","Moderate malt aroma, which can be a combination of toasty, biscuity, or nutty, possibly with a touch of light caramel or honey. Moderate to moderately high fruitiness with an orange- or pear-like character. Low to moderate strength hop character (spicy, herbal, or floral) optionally blended with background level peppery, spicy phenols. The hop character is lower in balance than the malt and fruitiness. ","Amber to copper in color. Clarity is very good. Creamy, rocky, white head often fades more quickly than other Belgian beers.","Has an initial soft, smooth, moderately malty flavor with a variable profile of toasty, biscuity, nutty, light caramel and/or honey notes. Moderate to moderately high fruitiness, sometimes orange- or pear-like. Relatively light (medium-low to low) spicy, herbal, or floral hop character. The hop bitterness is medium-high to medium-low, and is optionally enhanced by low to very low amounts of peppery phenols. There is a dry to balanced finish, with hops becoming more pronounced in the aftertaste of those with a drier finish. Fairly well balanced overall, with no single component being high in intensity; malt and fruitiness are more forward initially with a supportive bitterness and drying character coming on late.","Medium to medium-light body. Smooth palate. Alcohol level is restrained, and any warming character should be low if present. Medium to medium-high carbonation.","Most commonly found in the Flemish provinces of Antwerp and Brabant. Considered “everyday” beers (Category I). Compared to their higher alcohol Category S cousins, they are Belgian “session beers” for ease of drinking. Nothing should be too pronounced or dominant; balance is the key. Yeast character generally more subtle than many Belgian beers, with some of the fruitiness being hop-driven.","Produced by breweries with roots as far back as the mid-1700s, the most well-known examples were perfected after the Second World War with some influence from Britain, including hops and yeast strains. ","Pilsner or pale ale malt contributes the bulk of the grist with (cara) Vienna and Munich malts adding color, body and complexity. Sugar is not commonly used as high gravity is not desired. Saazer-type hops, Styrian Goldings, East Kent Goldings or Fuggles are commonly used. Yeasts prone to moderate production of phenols are often used but fermentation temperatures should be kept moderate to limit this character.","Fairly similar to pale ales from England (Strong Bitter category), typically with a slightly different yeast character and a more varied malt profile. Less yeast character than many other Belgian beers, though.","De Koninck, De Ryck Special, Palm Dobble, Palm Speciale",,,,
24C,Belgian Ale,Bière de Garde,Amber Ale,4,29,European Farmhouse Beer,France,6,8.5,18,28,6,19,1060,1080,1008,1016,"A fairly strong, malt-accentuated, lagered artisanal beer with a range of malt flavors appropriate for the color. All are malty yet dry, with clean flavors and a smooth character.","Prominent malty sweetness, often with a complex, light to moderate intensity toasty-bready-rich malt character. Low to moderate esters. Little to no hop aroma (may be a bit spicy, peppery, or herbal). Paler versions will still be malty but will lack richer, deeper aromatics and may have a bit more hops. Generally quite clean, although stronger versions may have a light, spicy alcohol note as it warms.","Three main variations exist (blond, amber and brown), so color can range from golden-blonde to reddish-bronze to chestnut brown. Clarity is brilliant to fair, although haze is not unexpected in this type of often unfiltered beer. Well-formed head, generally white to off-white (varies by beer color), average persistence. ","Medium to high malt flavor often with a toasty-rich, biscuity, toffee-like or light caramel-sweet character. Malt flavors and complexity tend to increase with beer color. Low to moderate esters and alcohol flavors. Medium-low hop bitterness provides some support, but the balance is always tilted toward the malt. Darker versions will have more of an initial malty-sweet impression than paler versions, but all should be malty in the palate and finish. The malt flavor lasts into the finish, which is medium-dry to dry, never cloying. Low to no hop flavor (spicy, peppery, or herbal), although paler versions can have slightly higher levels of herbal or spicy hop flavor (which can also come from the yeast). Smooth, well-lagered character, even if made with ale yeast. Aftertaste of malt (character appropriate for the color) with some dryness and light alcohol.","Medium to medium-light (lean) body, often with a smooth, creamy-silky character. Moderate to high carbonation. Moderate alcohol warming, but should be very smooth and never hot.","Three main variations are included in the style: the brown (brune), the blond (blonde), and the amber (ambrée). The darker versions will have more malt character, while the paler versions can have more hops (but still are malt-focused beers). A related style is Bière de Mars, which is brewed in March (Mars) for present use and will not age as well. Attenuation rates are in the 80-85% range. Some fuller-bodied examples exist, but these are somewhat rare. Age and oxidation in imports often increases fruitiness, caramel flavors, and adds corked and musty notes; these are all signs of mishandling, not characteristic elements of the style.",Name literally means “beer which has been kept or lagered.” A traditional artisanal ale from Northern France brewed in early spring and kept in cold cellars for consumption in warmer weather. It is now brewed year-round. ,"The “cellar” character commonly described in literature is more of a feature of mishandled commercial exports than fresh, authentic products. The somewhat moldy character comes from the corks and/or oxidation in commercial versions, and is incorrectly identified as “musty” or “cellar-like.” Base malts vary by beer color, but usually include pale, Vienna and Munich types. Darker versions will have richer malt complexity and sweetness from crystal-type malts. Sugar may be used to add flavor and aid in the dry finish. Lager or ale yeast fermented at cool ale temperatures, followed by long cold conditioning. Floral, herbal or spicy continental hops.","Related to the Belgian Saison style, the main difference is that the Bière de Garde is rounder, richer, malt-focused, and lacks the spicy, bitter character of a Saison.","Ch’Ti (brown and blond), Jenlain (amber and blond), La Choulette (all 3 versions), St. Amand (brown), Saint Sylvestre 3 Monts (blond), Russian River Perdition",,,,
