#,BJCP Categories,Styles,Style Family,Style_Family_ID,StyleID,Style History,Origin,ABV min,ABV max,IBUs min,IBUs max,SRM min,SRM max,OG min,OG max,FG min,FG max,Overall Impression,Aroma,Appearance,Flavor,Mouthfell,Comments,History,Characteristic Ingredients,Style Comparison,Commercial Examples,Notes,,,
16A,Dark British Beer,Sweet Stout,Stout,8,162,English Stout,England,4,6,20,40,30,40,1044,1060,1012,1024,"A very dark, sweet, full-bodied, slightly roasty ale that can suggest coffee-and-cream, or sweetened espresso.","Mild roasted grain aroma, sometimes with coffee and/or chocolate notes. An impression of cream-like sweetness often exists. Fruitiness can be low to moderately high. Diacetyl low to none. Hop aroma low to none, with floral or earthy notes.","Very dark brown to black in color. Can be opaque (if not, it should be clear). Creamy tan to brown head.","Dark roasted grain/malt impression with coffee and/or chocolate flavors dominate the palate. Hop bitterness is moderate. Medium to high sweetness provides a counterpoint to the roasted character and hop bitterness, and lasts into the finish. Low to moderate fruity esters. Diacetyl low to none. The balance between dark grains/malts and sweetness can vary, from quite sweet to moderately dry and somewhat roasty.",Medium-full to full-bodied and creamy. Low to moderate carbonation. High residual sweetness from unfermented sugars enhances the full-tasting mouthfeel.,"Gravities are low in England, higher in exported and US products. Variations exist, with the level of residual sweetness, the intensity of the roast character, and the balance between the two being the variables most subject to interpretation. Some versions in England are very sweet (low attenuation) and also low in ABV (Tennent’s Sweetheart Stout is 2%), but is an outlier compared to the other examples. These guidelines mostly describe the higher gravity, more balanced, export versions rather than the low alcohol, very sweet versions that many find quite difficult to drink.","An English style of stout developed in the early 1900s. Historically known as “Milk” or “Cream” stouts, legally this designation is no longer permitted in England (but is acceptable elsewhere). The “milk” name is derived from the use of lactose, or milk sugar, as a sweetener. Originally marketed as a tonic for invalids and nursing mothers.","The sweetness in most Sweet Stouts comes from a lower bitterness level than most other stouts and a high percentage of unfermentable dextrins. Lactose, an unfermentable sugar, is frequently added to provide additional residual sweetness. Base of pale malt, and may use roasted barley, black malt, chocolate malt, crystal malt, and adjuncts such as maize or brewing sugars.","Much sweeter and less bitter than other stouts (except the stronger tropical stout). The roast character is mild, not burnt like other stouts. Somewhat similar in balance to oatmeal stouts, albeit with more sweetness.","Bristol Beer Factory Milk Stout, Left Hand Milk Stout, Lancaster Milk Stout, Mackeson's XXX Stout, Marston’s Oyster Stout, Samuel Adams Cream Stout",,,,
16B,Dark British Beer,Oatmeal Stout,Stout,8,114,English Stout,England,4.2,5.9,25,40,22,40,1045,1065,1010,1018,"A very dark, full-bodied, roasty, malty ale with a complementary oatmeal flavor. The sweetness, balance, and oatmeal impression can vary considerably.","Mild roasted grain aromas, generally with a coffee-like character. A light malty sweetness can suggest a coffee-and-cream impression. Fruitiness should be low to medium-high. Diacetyl medium-low to none. Hop aroma medium-low to none, earthy or floral. A light grainy-nutty oatmeal aroma is optional.","Medium brown to black in color. Thick, creamy, persistent tan- to brown-colored head. Can be opaque (if not, it should be clear).","Similar to the aroma, with a mild roasted coffee to coffee-and-cream flavor, and low to moderately-high fruitiness. Oats and dark roasted grains provide some flavor complexity; the oats can add a nutty, grainy or earthy flavor. Dark grains can combine with malt sweetness to give the impression of milk chocolate or coffee with cream. Medium hop bitterness with the balance toward malt. Medium-sweet to medium-dry finish. Diacetyl medium-low to none. Hop flavor medium-low to none, typically earthy or floral.","Medium-full to full body, with a smooth, silky, velvety, sometimes an almost oily slickness from the oatmeal. Creamy. Medium to medium-high carbonation. ","Generally between Sweet and Irish Stouts in sweetness. Variations exist, from fairly sweet to quite dry, as well as English and American versions (American versions tend to be more hoppy, less sweet, and less fruity). The level of bitterness also varies, as does the oatmeal impression. Light use of oatmeal may give a certain silkiness of body and richness of flavor, while heavy use of oatmeal can be fairly intense in flavor with an almost oily mouthfeel, dryish finish, and slight grainy astringency. When judging, allow for differences in interpretation.","A variant of nourishing or invalid stouts of the late 1800s using oatmeal in the grist, similar to the development of sweet stout that used lactose. An original Scottish version used a significant amount of oat malt. Later went through a shady phase where some English brewers would throw a handful of oats into their parti-gyled stouts in order to legally produce a ‘healthy’ Oatmeal Stout for marketing purposes. Most popular in England between the World Wars, was revived in the craft beer era for export, which helped lead to its adoption as a popular modern American craft beer style that uses a noticeable (not symbolic) quantity of oats.","Pale, caramel and dark roasted malts (often chocolate) and grains. Oatmeal or malted oats (5-20% or more) used to enhance fullness of body and complexity of flavor. Hops primarily for bittering. Can use brewing sugars or syrups. English ale yeast.","Most are like a cross between an Irish Extra Stout and a Sweet Stout with oatmeal added. Several variations exist, with the sweeter versions more like a Sweet Stout with oatmeal instead of lactose, and the drier versions more like a more nutty, flavorful Irish Extra Stout. Both tend to emphasize the body and mouthfeel.","Anderson Valley Barney Flats Oatmeal Stout, Broughton Scottish Oatmeal Stout, Figueroa Mountain Stagecoach Stout, St-Ambroise Oatmeal Stout, Samuel Smith Oatmeal Stout, Young's Oatmeal Stout",,,,
16C,Dark British Beer,Tropical Stout,Stout,8,166,English Stout,England,5.5,8,30,50,30,40,1056,1075,1010,1018,"A very dark, sweet, fruity, moderately strong ale with smooth roasty flavors without a burnt harshness.","Sweetness evident, moderate to high intensity. Roasted grain aromas moderate to high, and can have coffee or chocolate notes. Fruitiness medium to high. May have a molasses, licorice, dried fruit, and/or vinous aromatics. Stronger versions can have a subtle clean aroma of alcohol. Hop aroma low to none. Diacetyl low to none.","Very deep brown to black in color. Clarity usually obscured by deep color (if not opaque, should be clear). Large tan to brown head with good retention.","Quite sweet with a smooth dark grain flavors, and restrained bitterness. Roasted grain and malt character can be moderate to high with a smooth coffee or chocolate flavor, although the roast character is moderated in the balance by the sweet finish. Moderate to high fruity esters. Can have a sweet, dark rum-like quality. Little to no hop flavor. Medium-low to no diacetyl.","Medium-full to full body, often with a smooth, creamy character. May give a warming (but never hot) impression from alcohol presence. Moderate to moderately-high carbonation.",Sweetness levels can vary significantly. Surprisingly refreshing in a hot climate.,"Originally high-gravity stouts brewed for tropical markets, became popular and imitated by local brewers often using local sugars and ingredients.","Similar to a sweet stout, but with more gravity. Pale and dark roasted malts and grains. Hops mostly for bitterness. May use adjuncts and sugar to boost gravity. Typically made with warm-fermented lager yeast.","Tastes like a scaled-up sweet stout with higher fruitiness. Similar to some Imperial Stouts without the high bitterness, strong/burnt roastiness, and late hops, and with lower alcohol. Much more sweet and less hoppy than American Stouts. Much sweeter and less bitter than the similar-gravity Export Stouts.","ABC Extra Stout, Dragon Stout, Jamaica Stout, Lion Stout, Royal Extra Stout",,,,
16D,Dark British Beer,Foreign Extra Stout,Stout,8,72,Irish Stout,England,6.3,8,50,70,30,40,1056,1075,1010,1018,"A very dark, moderately strong, fairly dry, stout with prominent roast flavors.","Moderate to high roasted grain aromas, often with coffee, chocolate and/or lightly burnt notes. Low to medium fruitiness. May have a sweet aroma, or molasses, licorice, dried fruit, and/or vinous aromatics. Stronger versions can have a subtle, clean aroma of alcohol. Hop aroma moderately low to none, can be earthy, herbal or floral. Diacetyl low to none.","Very deep brown to black in color. Clarity usually obscured by deep color (if not opaque, should be clear). Large tan to brown head with good retention.","Moderate to high roasted grain and malt flavor with a coffee, chocolate, or lightly burnt grain character, although without a sharp bite. Moderately dry. Low to medium esters. Medium to high bitterness. Moderate to no hop flavor, can be earthy, herbal, or floral. Diacetyl medium-low to none.","Medium-full to full body, often with a smooth, sometimes creamy character. May give a warming (but never hot) impression from alcohol presence. Moderate to moderately-high carbonation.","Also known as Foreign Stout, Export Stout, Foreign Export Stout. Historic versions (before WWI, at least) had the same OG as domestic Extra Stouts, but had a higher ABV because it had a long secondary with Brettanomyces chewing away at it. The difference between domestic and foreign versions were the hopping and length of maturation. ","Stronger stouts brewed for the export market today, but with a history stretching back to the 18th and 19th centuries when they were more heavily-hopped versions of stronger export stouts. Guinness Foreign Extra Stout (originally, West India Porter, later Foreign Extra Double Stout) was first brewed in 1801 according to Guinness with “extra hops to give it a distinctive taste and a longer shelf life in hot weather, this is brewed [today] in Africa, Asia and the Caribbean. It [currently] makes up 40% of all the Guinness brewed around the world.” ","Pale and dark roasted malts and grains, historically also could have used brown and amber malts. Hops mostly for bitterness, typically English varieties. May use adjuncts and sugar to boost gravity.","Similar in balance to an Irish Extra Stout, but with more alcohol. Not as big or intense as a Russian Imperial Stout. Lacking the strong bitterness and high late hops of American Stouts. Similar gravity as Tropical Stout, but with a drier finish, higher bitterness, and less esters.","Coopers Best Extra Stout, Guinness Foreign Extra Stout, The Kernel Export Stout, Ridgeway Foreign Export Stout, Southwark Old Stout",,,,
17A,Strong British Ale,British Strong Ale,Strong Ale,9,36,Strong Ale,England,5.5,8,30,60,8,22,1055,1080,1015,1022,"An ale of respectable alcoholic strength, traditionally bottled-conditioned and cellared. Can have a wide range of interpretations, but most will have varying degrees of malty richness, late hops and bitterness, fruity esters, and alcohol warmth. Judges should allow for a significant range in character, as long as the beer is within the alcohol strength range and has an interesting ‘British’ character, it likely fits the style. The malt and adjunct flavors and intensity can vary widely, but any combination should result in an agreeable palate experience.","Malty-sweet with fruity esters, often with a complex blend of dried-fruit, caramel, nuts, toffee, and/or other specialty malt aromas. Some alcohol notes are acceptable, but shouldn’t be hot or solventy. Hop aromas can vary widely, but typically have earthy, resiny, fruity, and/or floral notes. The balance can vary widely, but most examples will have a blend of malt, fruit, hops, and alcohol in varying intensities.","Deep gold to dark reddish-brown color (many are fairly dark). Generally clear, although darker versions may be almost opaque. Moderate to low cream- to light tan-colored head; average retention.","Medium to high malt character often rich with nutty, toffee, or caramel flavors. Light chocolate notes are sometimes found in darker beers. May have interesting flavor complexity from brewing sugars. Balance is often malty, but may be well hopped, which affects the impression of maltiness. Moderate fruity esters are common, often with a dark fruit or dried fruit character. The finish may vary from medium dry to somewhat sweet. Alcoholic strength should be evident, though not overwhelming. Diacetyl low to none, and is generally not desirable. ","Medium to full, chewy body. Alcohol warmth is often evident and always welcome. Low to moderate carbonation. Smooth texture.","As an entry category more than a style, the strength and character of examples can vary widely. Fits in the style space between normal gravity beers (strong bitters, brown ales, English porters) and barleywines. Can include pale malty-hoppy beers, English winter warmers, strong dark milds, smaller Burton ales, and other unique beers in the general gravity range that don’t fit other categories. Traditionally a bottle-conditioned product suitable for cellaring.","The heritage varies since this category generally reflects a grouping of unrelated minor styles with limited production. Some are historical recreations while others are modern. Some directly descend from older styles such as Burton ales, while others maintain a historical connection with older beers. As a grouping, the notion is relatively modern since beers of this strength category would not have been abnormal in past centuries. Do not use this category grouping to infer historical relationships between examples; this is almost a modern British specialty category where the ‘special’ attribute is alcohol level. ","Grists vary, often based on pale malt with caramel and specialty malts. Some darker examples suggest that dark malts (e.g., chocolate, black malt) may be appropriate, though sparingly so as to avoid an overly roasted character. Sugary adjuncts are common, as are starchy adjuncts (maize, flaked barley, wheat). Finishing hops are traditionally English. ","Significant overlap in gravity with old ales, but not having a stale or aged character. A wide range of interpretations is possible. Should not be as rich or strong as an English Barleywine. Stronger than the stronger everyday beers (strong bitters, brown ales, porters). More specialty malt and/or sugar character than American Strong Ales.","Fuller’s 1845, Harvey’s Elizabethan Ale, J.W. Lees Manchester Star, Samuel Smith’s Winter Welcome, Young's Winter Warmer",,,,
17B,Strong British Ale,Old Ale,Strong Ale,9,116,Strong Ale,England,5.5,9,30,60,10,22,1055,1088,1015,1022,"An ale of moderate to fairly significant alcoholic strength, bigger than standard beers, though usually not as strong or rich as barleywine. Often tilted towards a maltier balance. “It should be a warming beer of the type that is best drunk in half pints by a warm fire on a cold winter’s night” – Michael Jackson.","Malty-sweet with fruity esters, often with a complex blend of dried-fruit, vinous, caramelly, molasses, nutty, toffee, light treacle, and/or other specialty malt aromas. Some alcohol and oxidative notes are acceptable, akin to those found in Sherry or Port. Hop aromas not usually present due to extended aging.","Light amber to very dark reddish-brown color (most are fairly dark). Age and oxidation may darken the beer further. May be almost opaque (if not, should be clear). Moderate to low cream- to light tan-colored head; may be adversely affected by alcohol and age.","Medium to high malt character with a luscious malt complexity, often with nutty, caramelly and/or molasses-like flavors. Light chocolate or roasted malt flavors are optional, but should never be prominent. Balance is often malty-sweet, but may be well hopped (the impression of bitterness often depends on amount of aging). Moderate to high fruity esters are common, and may take on a dried-fruit or vinous character. The finish may vary from dry to somewhat sweet. Extended aging may contribute oxidative flavors similar to a fine old Sherry, Port or Madeira. Alcoholic strength should be evident, though not overwhelming. Diacetyl low to none. Some wood-aged or blended versions may have a lactic or Brettanomyces character; but this is optional and should not be too strong. Any acidity or tannin from age should be well-integrated and contribute to complexity in the flavor profile, not be a dominant experience.","Medium to full, chewy body, although older examples may be lower in body due to continued attenuation during conditioning. Alcohol warmth is often evident and always welcome. Low to moderate carbonation, depending on age and conditioning. Light acidity may be present, as well as some tannin if wood-aged; both are optional.","Strength and character varies widely. The predominant defining quality for this style is the impression of age, which can manifest itself in different ways (complexity, lactic, Brett, oxidation, leather, vinous qualities, etc.). Even if these qualities are otherwise faults, if the resulting character of the beer is still pleasantly drinkable and complex, then those characteristics are acceptable. In no way should those allowable characteristics be interpreted as making an undrinkably off beer as somehow in style. Old Peculier is a fairly unique type of beer that is quite different than other Old Ales.","Historically, an aged ale used as stock ales for blending or enjoyed at full strength (stale or stock refers to beers that were aged or stored for a significant period of time). There are at least two definite types in Britain today, weaker draught ones that are similar aged milds of around 4.5%, and stronger ones that are often 6-8% or more.","Composition varies, although generally similar to British Strong Ales. The age character is the biggest driver of the final style profile, which is more handling than brewing. May be aged in wood, but should not have a strong wood character.","Roughly overlapping the British Strong Ale and the lower end of the English Barleywine styles, but always having an aged quality. The distinction between an Old Ale and a Barleywine is somewhat arbitrary above 7% ABV, and generally means having a more significant aged quality (particularly from wood). Barleywines tend to develop more of a ‘mature’ quality, while Old Ales can show more of the barrel qualities (lactic, Brett, vinous, etc.).","Burton Bridge Olde Expensive, Gale’s Prize Old Ale, Greene King Strong Suffolk Ale, Marston Owd Roger, Theakston Old Peculier",,,,
17C,Strong British Ale,Wee Heavy,Strong Ale,9,168,,Scotland,6.5,10,17,35,14,25,1070,1130,1018,1040,"Rich, malty, dextrinous, and usually caramel-sweet, these beers can give an impression that is suggestive of a dessert. Complex secondary malt and alcohol flavors prevent a one-dimensional quality. Strength and maltiness can vary, but should not be cloying or syrupy.","Deeply malty, with a strong caramel component. Lightly smoky secondary aromas may also be present, adding complexity; peat smoke is inappropriate. Diacetyl should be low to none. Low to moderate esters and alcohol are often present in stronger versions. Hops are very low to none, and can be slightly earthy or floral.","Light copper to dark brown color, often with deep ruby highlights. Clear. Usually has a large tan head, which may not persist. Legs may be evident in stronger versions.","Richly malty with significant caramel (particularly in stronger versions). Hints of roasted malt may be present (sometimes perceived as a faint smoke character), as may some nutty character, all of which may last into the finish. Peat smoke is inappropriate. Hop flavors and bitterness are low to medium-low, so the malt presence should dominate the balance. Diacetyl should be low to none. Low to moderate esters and alcohol are usually present. Esters may suggest plums, raisins or dried fruit. The palate is usually full and sweet, but the finish may be sweet to medium-dry, sometimes with a light roasty-grainy note.","Medium-full to full-bodied, with some versions (but not all) having a thick, chewy viscosity. A smooth, alcoholic warmth is usually present and is quite welcome since it balances the malty sweetness. Moderate carbonation.","Also known as “strong Scotch ale.” The term “wee heavy” means “small strong” and traces to the beer that made the term famous, Fowler’s Wee Heavy, a 12 Guinea Ale. Historically, the strongest beer from a Scottish ale parti-gyle.","More related to historical brews than modern lower-strength Scottish ales, these beers have their roots in the strong ales of the 1700s and 1800s, although formulations and methods have changed. A premium product, often produced for export. Modern versions have lower starting and finishing gravities than their historical ancestors.","Well-modified pale malt, with roasted barley for color. May use some crystal malt for color adjustment. Slight smoke character may be present in some versions, but derives from roasted grains or from the boil. Peated malt is absolutely not traditional.",Somewhat similar to an English Barleywine.,"Belhaven Wee Heavy, Gordon Highland Scotch Ale, Inveralmond Blackfriar, McEwan's Scotch Ale, Orkney Skull Splitter, Traquair House Ale",,,,
