#,BJCP Categories,Styles,Style Family,Style_Family_ID,StyleID,Style History,Origin,ABV min,ABV max,IBUs min,IBUs max,SRM min,SRM max,OG min,OG max,FG min,FG max,Overall Impression,Aroma,Appearance,Flavor,Mouthfell,Comments,History,Characteristic Ingredients,Style Comparison,Commercial Examples,Notes,,,
01A,Standard American Beer,American Light Lager,Pale Lager,1,9,Mass Market Pale Lager,United States,2.8,4.2,8,12,2,3,1028,1040,998,1008,"Highly carbonated, very light-bodied, nearly flavorless lager designed to be consumed very cold. Very refreshing and thirst quenching.","Low to no malt aroma, although it can be perceived as grainy, sweet, or corn-like if present. Hop aroma is light to none, with a spicy or floral hop character if present. While a clean fermentation character is desirable, a light amount of yeast character (particularly a light apple fruitiness) is not a fault. Light DMS is not a fault.","Very pale straw to pale yellow color. White, frothy head seldom persists. Very clear.","Relatively neutral palate with a crisp and dry finish and a low to very low grainy or corn-like flavor that might be perceived as sweetness due to the low bitterness. Hop flavor ranges from none to low levels, and can have a floral, spicy, or herbal quality (although rarely strong enough to detect). Low to very low hop bitterness. Balance may vary from slightly malty to slightly bitter, but is relatively close to even. High levels of carbonation may accentuate the crispness of the dry finish. Clean lager fermentation character.",Very light (sometimes watery) body. Very highly carbonated with slight carbonic bite on the tongue.,Designed to appeal to as broad a range of the general public as possible. Strong flavors are a fault.,"Coors briefly made a light lager in the early 1940s. Modern versions were first produced by Rheingold in 1967 to appeal to diet-conscious drinkers, but only became popular starting in 1973 after Miller Brewing acquired the recipe and marketed the beer heavily to sports fans with the “tastes great, less filling” campaign. Beers of this genre became the largest sellers in the United States in the 1990s.",Two- or six-row barley with high percentage (up to 40%) of rice or corn as adjuncts. Additional enzymes can further lighten the body and lower carbohydrates.,"A lighter-bodied, lower-alcohol, lower calorie version of an American Lager. Less hop character and bitterness than a Leichtbier. ","Bud Light, Coors Light, Keystone Light, Michelob Light, Miller Lite, Old Milwaukee Light",,,,
01B,Standard American Beer,American Lager,Pale Lager,1,8,Mass Market Pale Lager,United States,4.2,5.3,8,18,2,4,1040,1050,1004,1010,"A very pale, highly-carbonated, light-bodied, well-attenuated lager with a very neutral flavor profile and low bitterness. Served very cold, it can be a very refreshing and thirst quenching drink.","Low to no malt aroma, although it can be perceived as grainy, sweet or corn-like if present. Hop aroma may range from none to a light, spicy or floral hop presence. While a clean fermentation character is desirable, a light amount of yeast character (particularly a light apple character) is not a fault. Light DMS is also not a fault.","Very pale straw to medium yellow color. White, frothy head seldom persists. Very clear.","Relatively neutral palate with a crisp and dry finish and a moderately-low to low grainy or corn-like flavor that might be perceived as sweetness due to the low bitterness. Hop flavor ranges from none to moderately-low levels, and can have a floral, spicy, or herbal quality (although often not strong enough to distinguish). Hop bitterness at low to medium-low level. Balance may vary from slightly malty to slightly bitter, but is relatively close to even. High levels of carbonation may accentuate the crispness of the dry finish. Clean lager fermentation character.",Low to medium-low body. Very highly carbonated with slight carbonic bite on the tongue.,"Strong flavors are a fault. Often what non-craft beer drinkers expect to be served if they order beer in the United States. May be marketed as Pilsner beers outside of Europe, but should not be confused with traditional examples.","Although German immigrants had brewed traditional Pilsner-inspired lager beer in the United States since the mid-late 1800s, the modern American lager style was heavily influenced by Prohibition and World War II. Surviving breweries consolidated, expanded distribution, and heavily promoted a beer style that was appealing to a broad range of the population. Became the dominant beer style for many decades, and spawning many international rivals who would develop similarly bland products for the mass market supported by heavy advertising.",Two- or six-row barley with high percentage (up to 40%) of rice or corn as adjuncts.,"Stronger, more flavor and body than a Light American Lager. Less bitterness and flavor than an International Lager. Significantly less flavor, hops, and bitterness than traditional European Pilsners.","Budweiser, Coors Original, Grain Belt Premium Lager, Miller High Life, Pabst Blue Ribbon, Special Export",,,,
01C,Standard American Beer,Cream Ale,Pale Ale,2,45,Indigenous American Beer,United States,4.2,5.6,8,20,2.5,5,1042,1055,1006,1012,"A clean, well-attenuated, flavorful American “lawnmower” beer. Easily drinkable and refreshing, with more character than typical American lagers.","Medium-low to low malt notes, with a sweet, corn-like aroma. Low levels of DMS are allowable, but are not required. Hop aroma medium low to none, and can be of any variety although floral, spicy, or herbal notes are most common. Overall, a subtle aroma with neither hops nor malt dominating. Low fruity esters are optional.","Pale straw to moderate gold color, although usually on the pale side. Low to medium head with medium to high carbonation. Fair head retention. Brilliant, sparkling clarity.","Low to medium-low hop bitterness. Low to moderate maltiness and sweetness, varying with gravity and attenuation. Usually well-attenuated. Neither malt nor hops dominate the palate. A low to moderate corny flavor is commonly found, as is light DMS (optional). Finish can vary from somewhat dry to faintly sweet. Low fruity esters are optional. Low to medium-low hop flavor (any variety, but typically floral, spicy, or herbal).","Generally light and crisp, although body can reach medium. Smooth mouthfeel with medium to high attenuation; higher attenuation levels can lend a “thirst quenching” quality. High carbonation. ","Pre-prohibition Cream Ales were slightly stronger, hoppier (including some dry hopping) and more bitter (25-30+ IBUs). These versions should be entered in the historical category. Most commercial examples are in the 1.050–1.053 OG range, and bitterness rarely rises above 20 IBUs.","A sparkling or present-use ale that existed in the 1800s and survived prohibition. An ale version of the American lager style. Produced by ale brewers to compete with lager brewers in Canada and the Northeast, Mid-Atlantic, and Midwest states. Originally known as sparkling or present use ales, lager strains were (and sometimes still are) used by some brewers, but were not historically mixed with ale strains. Many examples are kräusened to achieve carbonation. Cold conditioning isn’t traditional, although modern brewers sometimes use it.","American ingredients most commonly used. A grain bill of six-row malt, or a combination of six-row and North American two-row, is common. Adjuncts can include up to 20% maize in the mash, and up to 20% glucose or other sugars in the boil. Any variety of hops can be used for bittering and finishing.","Similar to a Standard American Lager, but with more character.","Genesee Cream Ale, Liebotschaner Cream Ale, Little Kings Cream Ale, New Glarus Spotted Cow, Old Style, Sleeman Cream Ale",,,,
01D,Standard American Beer,American Wheat Beer,Wheat Beer,3,14,Wheat Beer,United States,4,5.5,15,30,3,6,1040,1055,1008,1013,"Refreshing wheat beers that can display more hop character and less yeast character than their German cousins. A clean fermentation character allows bready, doughy, or grainy wheat flavors to be complemented by hop flavor and bitterness rather than yeast qualities.","Low to moderate grainy, bready, or doughy wheat character. A light to moderate malty sweetness is acceptable. Esters can be moderate to none, although should reflect relatively neutral yeast strains; banana is inappropriate. Hop aroma may be low to moderate, and can have a citrusy, spicy, floral, or fruity character. No clove phenols.","Usually pale yellow to gold. Clarity may range from brilliant to hazy with yeast approximating the German weissbier style of beer. Big, long-lasting white head.","Light to moderately-strong bready, doughy, or grainy wheat flavor, which can linger into the finish. May have a moderate malty sweetness or finish quite dry. Low to moderate hop bitterness, which sometimes lasts into the finish. Balance is usually even, but may be slightly bitter. Low to moderate hop flavor (citrusy, spicy, floral, or fruity). Esters can be moderate to none, but should not include banana. No clove phenols. May have a slightly crisp finish.","Medium-light to medium body. Medium-high to high carbonation. Slight creaminess is optional; wheat beers sometimes have a soft, ‘fluffy’ impression.","Different variations exist, from an easy-drinking fairly sweet beer to a dry, aggressively-hopped beer with a strong wheat flavor. American rye beers should be entered in the Alternative Fermentables specialty category.","An American craft beer adaptation of the German weissbier style using a cleaner yeast and more hops, first widely popularized by Widmer in the mid-1980s.","Clean American ale or lager yeast (German weissbier yeast is inappropriate). Large proportion of wheat malt (often 30–50%, which is lower than is typical in German weissbiers). American, German, or New World hops are typical.","More hop character and less yeast character than German weissbier. Never with the banana and clove character of German weissbier. Generally can have the same range and balance as Blonde Ales, but with a wheat character as the primary malt flavor.","Bell’s Oberon, Boulevard Unfiltered Wheat Beer, Goose Island 312 Urban Wheat Ale, Widmer Hefeweizen",,,,
02A,International Lager,International Pale Lager,Pale Lager,1,90,Mass Market Pale Lager,International,4.6,6,18,25,2,6,1042,1050,1008,1012,"A highly-attenuated pale lager without strong flavors, typically well-balanced and highly carbonated. Served cold, it is refreshing and thirst-quenching.","Low to medium-low malt aroma, which can be grainy-malty or slightly corny-sweet. Hop aroma may range from very low to a medium, spicy or floral hop presence. While a clean fermentation profile is generally most desirable, low levels of yeast character (such as a light apple fruitiness) are not a fault. A light amount of DMS or corn aroma is not a fault.","Pale straw to gold color. White, frothy head may not be long lasting. Very clear.","Low to moderate levels of grainy-malt flavor, with a crisp, dry, well-attenuated finish. The grain character can be somewhat neutral, or show a light bready-crackery quality or up to moderate corny or malty sweetness. Hop flavor ranges from none to medium levels, and often showing a floral, spicy, or herbal character if detected. Hop bitterness at medium-low to medium level. Balance may vary from slightly malty to slightly bitter, but is relatively close to even. Neutral aftertaste with light malt and sometimes hop flavors. A light amount of DMS is not a fault.",Light to medium body. Moderately high to highly carbonated. Can have a slight carbonic bite on the tongue.,"International lagers tend to have fewer adjuncts than standard American lagers. They may be all-malt, although strong flavors are still a fault. A broad category of international mass-market lagers ranging from up-scale American lagers to the typical “import” or “green bottle” international beers found in America and many export markets. Often confusingly labeled as a “Pilsner.” Any skunkiness in commercial beers from being lightstruck in a green bottle is a mishandling fault, not a characteristic of the style.","In the United States, developed as a premium version of the standard American lager, with a similar history. Outside the United States, developed either as an imitation of American style lagers, or as a more accessible (and often drier and less bitter) version of a Pilsner-type beer. Often heavily marketed and exported by large industrial or multi-national breweries.","Two- or six-row barley. May use rice, corn, or sugar as adjuncts, or may be all malt.","Generally more bitter and filling than American lager. Less hoppy and bitter than a German Pils. Less body, malt flavor, and hop character than a Czech Premium Pale Lager. More robust versions can approach a Munich Helles in flavor, although with more of an adjunct quality.","Asahi Super Dry, Birra Moretti, Corona Extra, Devils Backbone Gold Leaf Lager, Full Sail Session Premium Lager, Heineken, Red Stripe, Singha",,,,
03A,Czech Lager,Czech Pale Lager,Pale Lager,1,49,Pilsner,Czech Republic,3,4.1,20,35,3,6,1028,1044,1008,1014,"A lighter-bodied, rich, refreshing, hoppy, bitter pale Czech lager having the familiar flavors of the stronger Czech Premium Pale Lager (Pilsner-type) beer but in a lower alcohol, lighter-bodied, and slightly less intense format.","Light to moderate bready-rich malt combined with light to moderate spicy or herbal hop bouquet; the balance between the malt and hops may vary. Faint hint of caramel is acceptable. Light (but never intrusive) diacetyl and light, fruity hop-derived esters are acceptable, but need not be present. No sulfur.","Light gold to deep gold color. Brilliant to very clear, with a long-lasting, creamy white head. ","Medium-low to medium bready-rich malt flavor with a rounded, hoppy finish. Low to medium-high spicy or herbal hop flavor. Bitterness is prominent but never harsh. Flavorful and refreshing. Diacetyl or fruity esters are acceptable at low levels, but need not be present and should never be overbearing.",Medium-light to medium body. Moderate carbonation. ,The Czech name of the style is sv?tlé vý?epní pivo. ,"Josef Groll initially brewed two types of beer in 1842–3, a vý?epní and a ležák, with the smaller beer having twice the production; Evan Rail speculates that these were probably 10 °P and 12 °P beers, but that the vý?epní could have been weaker. This is the most consumed type of beer in the Czech Republic at present.","Soft water with low sulfate and carbonate content, Saazer-type hops, Czech Pilsner malt, Czech lager yeast. Low ion water provides a distinctively soft, rounded hop profile despite high hopping rates. ","A lighter-bodied, lower-intensity, refreshing, everyday version of Czech Premium Pale Lager.","B?ez?ák Sv?tlé vý?epní pivo, Notch Session Pils, Pivovar Kout na Šumav? Koutská 10°, Ún?tické pivo 10°",,,,
04A,Pale Malty European Lager,Munich Helles,Pale Lager,1,109,European Pale Lager,Germany,4.7,5.4,16,22,3,5,1044,1048,1006,1012,"A clean, malty, gold-colored German lager with a smooth grainy-sweet malty flavor and a soft, dry finish. Subtle spicy, floral, or herbal hops and restrained bitterness help keep the balance malty but not sweet, which helps make this beer a refreshing, everyday drink.","Moderate grainy-sweet malt aroma. Low to moderately-low spicy, floral, or herbal hop aroma. While a clean aroma is most desirable, a very low background note of DMS is not a fault. Pleasant, clean fermentation profile, with malt dominating the balance. The freshest examples will have more of a malty-sweet aroma.",Medium yellow to pale gold. Clear. Persistent creamy white head.,"Moderately malty start with the suggestion of sweetness, moderate grainy-sweet malt flavor with a soft, rounded palate impression, supported by a low to medium-low hop bitterness. The finish is soft and dry, not crisp and biting. Low to moderately-low spicy, floral or herbal hop flavor. The malt dominates the hops in the palate, finish, and aftertaste, but the hops should be noticeable. There should not be any residual sweetness, simply the impression of maltiness with restrained bitterness. Very fresh examples will seem sweeter due to the fresh, rich malt character that can fade with time. Clean fermentation profile.","Medium body. Medium carbonation. Smooth, well-lagered character.","A fully-attenuated Pils malt showcase, Helles is a malt-accentuated beer that is not overly sweet, but rather focuses on malt flavor with underlying hop bitterness in a supporting role. Export examples can quickly lose some of the rich malt character that often suggests sweetness. Helles in Munich tends to be lighter in all aspects than those outside the city, which can be more assertive with more body, flavor, and hop character.",Created in Munich in 1894 at the Spaten brewery to compete with pale Pilsner-type beers. Currently the most popular style in Southern Germany.,"Continental Pilsner malt, traditional German Saazer-type hop varieties, clean German lager yeast.","Similar in malt balance and bitterness to Munich Dunkel, but less malty-sweet in nature and pale rather than dark. More body and malt presence than a German Pils, with less hop character throughout. Similar malt profile as a German Exportbier, but with less hops in the balance. ","Augustiner Lagerbier Hell, Bürgerbräu Wolznacher Hell Naturtrüb, Hacker-Pschorr Münchner Gold, Löwenbraü Original, Paulaner Premium Lager, Spaten Premium Lager, Weihenstephaner Original",,,,
04B,Pale Malty European Lager,Festbier,Pale Lager,1,69,European Pale Lager,Germany,5.8,6.3,18,25,4,7,1054,1057,1010,1012,"A smooth, clean, pale German lager with a moderately strong malty flavor and a light hop character. Deftly balances strength and drinkability, with a palate impression and finish that encourages drinking. Showcases elegant German malt flavors without becoming too heavy or filling.","Moderate malty richness, with an emphasis on toasty-doughy aromatics and an impression of sweetness. Low to medium-low floral, herbal, or spicy hops. The malt should not have a deeply toasted, caramel, or biscuity quality. Clean lager fermentation character.",Deep yellow to deep gold color; should not have amber hues. Bright clarity. Persistent white to off-white foam stand. Most commercial examples are medium gold in color.,"Medium to medium-high malty flavor initially, with a lightly toasty, bread dough quality and an impression of soft sweetness. Medium to medium-low bitterness, definitely malty in the balance. Well-attenuated and crisp, but not dry. Medium-low to medium floral, herbal, or spicy hop flavor. Clean lager fermentation character. The taste is mostly of Pils malt, but with slightly toasty hints. The bitterness is supportive, but still should yield a malty, flavorful finish.","Medium body, with a smooth, somewhat creamy texture. Medium carbonation. Alcohol strength barely noticeable as warming, if at all. ","This style represents the modern German beer served at Oktoberfest (although it is not solely reserved for Oktoberfest; it can be found at many other ‘fests’), and is sometimes called Wiesn (“the meadow” or local name for the Oktoberfest festival). We chose to call this style Festbier since by German and EU regulations, Oktoberfestbier is a protected appellation for beer produced at large breweries within the Munich city limits for consumption at Oktoberfest. Other countries are not bound by these rules, so many craft breweries in the US produce beer called Oktoberfest, but based on the traditional style described in these guidelines as Märzen.","Since 1990, the majority of beer served at Oktoberfest in Munich has been this style. Export beer specifically made for the United States is still mainly of the traditional amber style, as are US-produced interpretations. Paulaner first created the golden version in the mid-1970s because they thought the traditional Oktoberfest was too filling. So they developed a lighter, more drinkable but still malty version that they wanted to be “more poundable” (according to the head brewer at Paulaner). But the actual type of beer served at Oktoberfest is set by a Munich city committee.","Majority Pils malt, but with some Vienna and/or Munich malt to increase maltiness. Differences in commercial examples are mostly due to different maltsters and yeast, not major grist differences.","Less intense and less richly toasted than a Märzen. More rich-heavy in body than a Helles, with more hop flavor and higher alcohol. Less rich in malt intensity than a Maibock. The malt complexity is similar to a higher-gravity Czech Premium Pale Lager, although without the associated hops.","Augustiner Oktoberfest, Hacker-Pschorr Superior Festbier, Hofbräu Festbier, Löwenbräu Oktoberfestbier, Paulaner Wiesn, Schönramer Gold, Weihenstephaner Festbier",,,,
05A,Pale Bitter European beer,German Leichtbier,Pale Lager,1,79,Pilsner,Germany,2.4,3.6,15,28,2,5,1026,1034,1006,1010,"A pale, highly-attenuated, light-bodied German lager with lower alcohol and calories than normal-strength beers. Moderately bitter with noticeable malt and hop flavors, the beer is still interesting to drink.","Low to medium hop aroma, with a spicy, herbal, or floral character. Low to medium-low grainy-sweet or slightly crackery malt aroma. Clean fermentation profile. ",Straw to pale gold in color. Brilliant clarity. Moderate white head with average to below average persistence.,"Low to medium grainy-sweet malt flavor initially. Medium hop bitterness. Low to medium hop flavor, with a spicy, herbal, or floral quality. Clean fermentation character, well-lagered. Dry finish with a light malty and hoppy aftertaste.","Light to very light body. Medium to high carbonation. Smooth, well-attenuated.","Marketed primarily as a diet-oriented beer with lower carbohydrates, alcohol, and calories. Pronounced “LYESHT-beer.” May also be known as a Diat Pils or Helles, this style is in the schankbier gravity class. Other variations of Leicht class beers can be made from Weissbier, Kölsch, and Altbier; those beers are best entered in the Mixed-Style Beer category.","Traditional versions existed as drinks for physical laborers in factories or fields, but modern versions are more based on popular American products in the same class.","Similar to a German Pils or Helles, continental Pils malt, German lager yeast, Saazer-type hops.","Like a lower-alcohol, lighter-bodied, slightly less aggressive German Pils or Helles.","Beck’s Light, Bitburger Light, Mahr’s Leicht, Paulaner Münchner Hell Leicht, Paulaner Premium Leicht",,,,
